{
  "schemaVersion": 1,
  "origin": "external_samples/KakaoTalk_Video_2026-07-18-19-03-47_분석.md",
  "designTokens": "src/promo/tokens.ts",
  "widgetSchema": "src/promo/schema.ts",
  "registry": "src/promo/registry.tsx",
  "widgets": [
    {
      "id": "gauge",
      "family": "meter",
      "originWidgets": [
        "W1a",
        "W1b"
      ],
      "component": "src/promo/bodies/Gauge.tsx",
      "summary": "니들 스윕(needle) 또는 아크 채움+틱 스포크 점등+골드 테일(fill-arc) 반원 게이지. 값 카운트업과 중앙 네스트 라벨을 포함한다.",
      "props": {
        "kind": "\"needle\" | \"fill-arc\" (기본 needle)",
        "value": "number — 표시 값 (min/max로 정규화, 범위 밖 클램프)",
        "min": "number (기본 0)",
        "max": "number",
        "unit": "string? — 값 병기 단위 (예: T, %)",
        "ticks": "int 0–60 (기본 24) — 눈금/스포크 개수",
        "goldTail": "boolean (기본 false) — fill-arc 끝단 골드 테일",
        "caption": "string? — 값 하단 캡션 pill",
        "sweepFrames": "int (기본 36) — 스윕 지속 프레임"
      },
      "demos": [
        {
          "page": 1,
          "type": "gauge",
          "kind": "needle",
          "x": 140,
          "y": 130,
          "w": 400,
          "h": 300,
          "enterAt": 0,
          "label": "OFFICIAL WEIGH-IN",
          "value": 2.8,
          "min": 0,
          "max": 3,
          "unit": "T",
          "ticks": 12,
          "goldTail": false,
          "sweepFrames": 36
        },
        {
          "page": 1,
          "type": "gauge",
          "kind": "fill-arc",
          "x": 660,
          "y": 130,
          "w": 400,
          "h": 300,
          "enterAt": 8,
          "label": "STREAK MONITOR",
          "value": 90,
          "min": 0,
          "max": 100,
          "unit": "%",
          "ticks": 24,
          "goldTail": true,
          "caption": "CODING",
          "sweepFrames": 42
        }
      ]
    },
    {
      "id": "statBar",
      "family": "bar",
      "originWidgets": [
        "W2",
        "W3"
      ],
      "component": "src/promo/bodies/StatBar.tsx",
      "summary": "좌→우 필 진행 바(눈금·우단 골드 라벨) 또는 주체 vs 라이벌 대결 바(중앙 VS 배지).",
      "props": {
        "mode": "\"progress\" | \"vs\" (기본 progress)",
        "value": "number — progress: 현재값 / vs: 주체 점수",
        "max": "number — 축 최대",
        "name": "string? — vs 주체 이름",
        "ticks": "{at, label}[] (기본 []) — 축 눈금",
        "endLabel": "string? — 우단 골드 라벨",
        "rivals": "{name, value}[] (기본 []) — vs 전용",
        "fillFrames": "int (기본 30) — 채움 지속 프레임"
      },
      "demos": [
        {
          "page": 1,
          "type": "statBar",
          "mode": "progress",
          "x": 140,
          "y": 560,
          "w": 800,
          "h": 130,
          "enterAt": 24,
          "label": "CONTEXT STAMINA",
          "value": 1000000,
          "max": 1000000,
          "ticks": [
            {
              "at": 100000,
              "label": "100K"
            },
            {
              "at": 500000,
              "label": "500K"
            },
            {
              "at": 1000000,
              "label": "1M"
            }
          ],
          "endLabel": "1M TOKENS",
          "rivals": [],
          "fillFrames": 40
        },
        {
          "page": 1,
          "type": "statBar",
          "mode": "vs",
          "x": 1040,
          "y": 540,
          "w": 740,
          "h": 170,
          "enterAt": 32,
          "label": "HEAD TO HEAD // TERMINAL",
          "name": "KIMI K3",
          "value": 88.3,
          "max": 100,
          "ticks": [],
          "rivals": [
            {
              "name": "OPUS 4.8",
              "value": 84.6
            },
            {
              "name": "FABLE 5",
              "value": 84.6
            }
          ],
          "fillFrames": 36
        }
      ]
    },
    {
      "id": "leaderboard",
      "family": "ranking",
      "originWidgets": [
        "W5"
      ],
      "component": "src/promo/bodies/Leaderboard.tsx",
      "summary": "pill 헤더 + 행(순위·이름·우측정렬 점수) 리더보드. 하이라이트 행 풀폭 블루 필과 리오더 상승 애니메이션.",
      "props": {
        "header": "string? — pill 헤더",
        "headerTag": "string? — 헤더 우측 보조",
        "rows": "{name, score, highlight?}[] (최소 1행)",
        "footer": "string? — 하단 중앙",
        "scoreDecimals": "int 0–3 (기본 1)",
        "reorder": "boolean (기본 false) — highlight 행 최하단→자기 순위 상승",
        "populateFrames": "int (기본 8) — 행당 진입 stagger"
      },
      "demos": [
        {
          "page": 1,
          "type": "leaderboard",
          "x": 1220,
          "y": 130,
          "w": 560,
          "h": 300,
          "enterAt": 16,
          "header": "PROGRAM BENCH",
          "headerTag": "ALL MODELS",
          "rows": [
            {
              "name": "KIMI K3",
              "score": 77.8,
              "highlight": true
            },
            {
              "name": "GPT-5.6 SOL",
              "score": 77.6,
              "highlight": false
            },
            {
              "name": "FABLE 5",
              "score": 76.8,
              "highlight": false
            }
          ],
          "footer": "NEW LEADER",
          "scoreDecimals": 1,
          "reorder": true,
          "populateFrames": 8
        }
      ]
    },
    {
      "id": "countUp",
      "family": "hero-number",
      "originWidgets": [
        "W8",
        "W9"
      ],
      "component": "src/promo/bodies/CountUp.tsx",
      "summary": "오도미터 히어로 숫자 카운트업. prefix(×·$·+)/suffix(T·%·PTS) 블루 강조, 언더라인 룰, 캡션.",
      "props": {
        "from": "number (기본 0)",
        "to": "number",
        "decimals": "int 0–3 (기본 1)",
        "prefix": "string? — 예: ×, $, +",
        "suffix": "string? — 예: T, %, PTS",
        "suffixAccent": "boolean (기본 true) — suffix 데이터 블루",
        "rule": "boolean (기본 false) — 하단 헤어라인",
        "caption": "string? — 하단 캡션",
        "countFrames": "int (기본 24) — 카운트 지속 프레임"
      },
      "demos": [
        {
          "page": 1,
          "type": "countUp",
          "x": 140,
          "y": 760,
          "w": 700,
          "h": 220,
          "enterAt": 44,
          "from": 1,
          "to": 6.3,
          "decimals": 1,
          "prefix": "×",
          "suffixAccent": true,
          "rule": true,
          "caption": "DECODING @ 1M CONTEXT",
          "countFrames": 30
        },
        {
          "page": 1,
          "type": "countUp",
          "x": 1040,
          "y": 760,
          "w": 700,
          "h": 220,
          "enterAt": 52,
          "from": 2.1,
          "to": 2.8,
          "decimals": 1,
          "suffix": "T",
          "suffixAccent": true,
          "rule": false,
          "caption": "TRILLION PARAMETERS",
          "countFrames": 24
        }
      ]
    },
    {
      "id": "rankLadder",
      "family": "ranking",
      "originWidgets": [
        "W6"
      ],
      "component": "src/promo/bodies/RankLadder.tsx",
      "summary": "수직 지그재그 순위 눈금 위로 pill 토큰이 등반한다 (#18위→단숨에 #2).",
      "props": {
        "ranks": "number[] (최소 2) — 아래→위 순 눈금",
        "climbTo": "int — 토큰 최종 순위",
        "climbFrames": "int (기본 40)"
      },
      "demos": [
        {
          "page": 2,
          "type": "rankLadder",
          "x": 140,
          "y": 130,
          "w": 300,
          "h": 560,
          "enterAt": 0,
          "label": "FRONTEND ARENA",
          "ranks": [
            15,
            12,
            9,
            6,
            4,
            3
          ],
          "climbTo": 2,
          "climbFrames": 46
        }
      ]
    },
    {
      "id": "numberLinePlot",
      "family": "data-panel",
      "originWidgets": [
        "W7"
      ],
      "component": "src/promo/bodies/NumberLinePlot.tsx",
      "summary": "수평 축 위 tone별 점(주체 블루·상대 레드) + CLOSING 점선 화살표 draw-on (ELO 추격 플롯).",
      "props": {
        "axisLabel": "string? — 축 라벨 (예: GDPval ELO)",
        "min": "number",
        "max": "number",
        "points": "{name, value, tone: data|rival|muted}[] (최소 1)",
        "arrowFrom": "string? — 화살표 시작 점 name",
        "arrowTo": "string? — 화살표 끝 점 name",
        "arrowLabel": "string? — 예: CLOSING",
        "drawFrames": "int (기본 30)"
      },
      "demos": [
        {
          "page": 2,
          "type": "numberLinePlot",
          "x": 520,
          "y": 150,
          "w": 860,
          "h": 290,
          "enterAt": 6,
          "label": "FINAL STRETCH // GDPVAL",
          "axisLabel": "GDPVAL ELO",
          "min": 1560,
          "max": 1800,
          "points": [
            {
              "name": "OPUS 4.8",
              "value": 1600,
              "tone": "muted"
            },
            {
              "name": "KIMI K3",
              "value": 1668,
              "tone": "data"
            },
            {
              "name": "FABLE 5",
              "value": 1760,
              "tone": "rival"
            }
          ],
          "arrowFrom": "KIMI K3",
          "arrowTo": "FABLE 5",
          "arrowLabel": "CLOSING",
          "drawFrames": 34
        }
      ]
    },
    {
      "id": "priceTag",
      "family": "hero-number",
      "originWidgets": [
        "W10"
      ],
      "component": "src/promo/bodies/PriceTag.tsx",
      "summary": "끈에 매달린 가격 태그의 감쇠 펜듈럼 스윙 + 취소선 고스트 잔상 가격 드롭.",
      "props": {
        "value": "string — 예: $3.00",
        "sub": "string? — 예: PER 1M TOKENS",
        "ghostValue": "string? — 위 취소선 잔상",
        "swing": "boolean (기본 true)"
      },
      "demos": [
        {
          "page": 2,
          "type": "priceTag",
          "x": 1460,
          "y": 120,
          "w": 320,
          "h": 400,
          "enterAt": 10,
          "label": "CACHE HIT",
          "value": "$0.30",
          "ghostValue": "$3.00",
          "sub": "INPUT / 1M TOKENS",
          "swing": true
        }
      ]
    },
    {
      "id": "nodeGraph",
      "family": "data-panel",
      "originWidgets": [
        "W11"
      ],
      "component": "src/promo/bodies/NodeGraph.tsx",